<?xml version="1.0"?>
<?xml-stylesheet type="text/xsl" href="pdml2html.xsl"?>
<!-- You can find pdml2html.xsl in D:\Wireshark or at http://anonsvn.wireshark.org/trunk/wireshark/pdml2html.xsl. -->
<pdml version="0" creator="wireshark/1.12.4" time="Mon Apr 25 10:12:03 2016" capture_file="C:\Users\sky\Desktop\dataSet\交易_ios.pcap">
<packet>
  <proto name="geninfo" pos="0" showname="General information" size="54">
    <field name="num" pos="0" show="1" showname="Number" value="1" size="54"/>
    <field name="len" pos="0" show="54" showname="Frame Length" value="36" size="54"/>
    <field name="caplen" pos="0" show="54" showname="Captured Length" value="36" size="54"/>
    <field name="timestamp" pos="0" show="Mar 24, 2016 10:12:23.460901000 中国标准时间" showname="Captured Time" value="1458785543.460901000" size="54"/>
  </proto>
  <proto name="frame" showname="Frame 1: 54 bytes on wire (432 bits), 54 bytes captured (432 bits)" size="54" pos="0">
    <field name="frame.encap_type" showname="Encapsulation type: Ethernet (1)" size="0" pos="0" show="1"/>
    <field name="frame.time" showname="Arrival Time: Mar 24, 2016 10:12:23.460901000 \xe4\xb8\xad\xe5\x9b\xbd\xe6\xa0\x87\xe5\x87\x86\xe6\x97\xb6\xe9\x97\xb4" size="0" pos="0" show="Mar 24, 2016 10:12:23.460901000 \xe4\xb8\xad\xe5\x9b\xbd\xe6\xa0\x87\xe5\x87\x86\xe6\x97\xb6\xe9\x97\xb4"/>
    <field name="frame.offset_shift" showname="Time shift for this packet: 0.000000000 seconds" size="0" pos="0" show="0.000000000"/>
    <field name="frame.time_epoch" showname="Epoch Time: 1458785543.460901000 seconds" size="0" pos="0" show="1458785543.460901000"/>
    <field name="frame.time_delta" showname="Time delta from previous captured frame: 0.000000000 seconds" size="0" pos="0" show="0.000000000"/>
    <field name="frame.time_delta_displayed" showname="Time delta from previous displayed frame: 0.000000000 seconds" size="0" pos="0" show="0.000000000"/>
    <field name="frame.time_relative" showname="Time since reference or first frame: 0.000000000 seconds" size="0" pos="0" show="0.000000000"/>
    <field name="frame.number" showname="Frame Number: 1" size="0" pos="0" show="1"/>
    <field name="frame.len" showname="Frame Length: 54 bytes (432 bits)" size="0" pos="0" show="54"/>
    <field name="frame.cap_len" showname="Capture Length: 54 bytes (432 bits)" size="0" pos="0" show="54"/>
    <field name="frame.marked" showname="Frame is marked: False" size="0" pos="0" show="0"/>
    <field name="frame.ignored" showname="Frame is ignored: False" size="0" pos="0" show="0"/>
    <field name="frame.protocols" showname="Protocols in frame: eth:ethertype:ip:tcp" size="0" pos="0" show="eth:ethertype:ip:tcp"/>
    <field name="frame.coloring_rule.name" showname="Coloring Rule Name: HTTP" size="0" pos="0" show="HTTP"/>
    <field name="frame.coloring_rule.string" showname="Coloring Rule String: http || tcp.port == 80 || http2" size="0" pos="0" show="http || tcp.port == 80 || http2"/>
  </proto>
  <proto name="eth" showname="Ethernet II, Src: 4a:86:87:51:89:29 (4a:86:87:51:89:29), Dst: Apple_d2:fb:83 (54:9f:13:d2:fb:83)" size="14" pos="0">
    <field name="eth.dst" showname="Destination: Apple_d2:fb:83 (54:9f:13:d2:fb:83)" size="6" pos="0" show="54:9f:13:d2:fb:83" value="549f13d2fb83">
      <field name="eth.dst_resolved" showname="Destination (resolved): Apple_d2:fb:83" hide="yes" size="6" pos="0" show="Apple_d2:fb:83" value="549f13d2fb83"/>
      <field name="eth.addr" showname="Address: Apple_d2:fb:83 (54:9f:13:d2:fb:83)" size="6" pos="0" show="54:9f:13:d2:fb:83" value="549f13d2fb83"/>
      <field name="eth.addr_resolved" showname="Address (resolved): Apple_d2:fb:83" hide="yes" size="6" pos="0" show="Apple_d2:fb:83" value="549f13d2fb83"/>
      <field name="eth.lg" showname=".... ..0. .... .... .... .... = LG bit: Globally unique address (factory default)" size="3" pos="0" show="0" value="0" unmaskedvalue="549f13"/>
      <field name="eth.ig" showname=".... ...0 .... .... .... .... = IG bit: Individual address (unicast)" size="3" pos="0" show="0" value="0" unmaskedvalue="549f13"/>
    </field>
    <field name="eth.src" showname="Source: 4a:86:87:51:89:29 (4a:86:87:51:89:29)" size="6" pos="6" show="4a:86:87:51:89:29" value="4a8687518929">
      <field name="eth.src_resolved" showname="Source (resolved): 4a:86:87:51:89:29" hide="yes" size="6" pos="6" show="4a:86:87:51:89:29" value="4a8687518929"/>
      <field name="eth.addr" showname="Address: 4a:86:87:51:89:29 (4a:86:87:51:89:29)" size="6" pos="6" show="4a:86:87:51:89:29" value="4a8687518929"/>
      <field name="eth.addr_resolved" showname="Address (resolved): 4a:86:87:51:89:29" hide="yes" size="6" pos="6" show="4a:86:87:51:89:29" value="4a8687518929"/>
      <field name="eth.lg" showname=".... ..1. .... .... .... .... = LG bit: Locally administered address (this is NOT the factory default)" size="3" pos="6" show="1" value="1" unmaskedvalue="4a8687"/>
      <field name="eth.ig" showname=".... ...0 .... .... .... .... = IG bit: Individual address (unicast)" size="3" pos="6" show="0" value="0" unmaskedvalue="4a8687"/>
    </field>
    <field name="eth.type" showname="Type: IP (0x0800)" size="2" pos="12" show="2048" value="0800"/>
  </proto>
  <proto name="ip" showname="Internet Protocol Version 4, Src: 120.132.34.25 (120.132.34.25), Dst: 172.28.102.2 (172.28.102.2)" size="20" pos="14">
    <field name="ip.version" showname="Version: 4" size="1" pos="14" show="4" value="45"/>
    <field name="ip.hdr_len" showname="Header Length: 20 bytes" size="1" pos="14" show="20" value="45"/>
    <field name="ip.dsfield" showname="Differentiated Services Field: 0x20 (DSCP 0x08: Class Selector 1; ECN: 0x00: Not-ECT (Not ECN-Capable Transport))" size="1" pos="15" show="32" value="20">
      <field name="ip.dsfield.dscp" showname="0010 00.. = Differentiated Services Codepoint: Class Selector 1 (0x08)" size="1" pos="15" show="8" value="8" unmaskedvalue="20"/>
      <field name="ip.dsfield.ecn" showname=".... ..00 = Explicit Congestion Notification: Not-ECT (Not ECN-Capable Transport) (0x00)" size="1" pos="15" show="0" value="0" unmaskedvalue="20"/>
    </field>
    <field name="ip.len" showname="Total Length: 40" size="2" pos="16" show="40" value="0028"/>
    <field name="ip.id" showname="Identification: 0x33ed (13293)" size="2" pos="18" show="13293" value="33ed"/>
    <field name="ip.flags" showname="Flags: 0x02 (Don&apos;t Fragment)" size="1" pos="20" show="2" value="40">
      <field name="ip.flags.rb" showname="0... .... = Reserved bit: Not set" size="1" pos="20" show="0" value="40"/>
      <field name="ip.flags.df" showname=".1.. .... = Don&apos;t fragment: Set" size="1" pos="20" show="1" value="40"/>
      <field name="ip.flags.mf" showname="..0. .... = More fragments: Not set" size="1" pos="20" show="0" value="40"/>
    </field>
    <field name="ip.frag_offset" showname="Fragment offset: 0" size="2" pos="20" show="0" value="4000"/>
    <field name="ip.ttl" showname="Time to live: 49" size="1" pos="22" show="49" value="31"/>
    <field name="ip.proto" showname="Protocol: TCP (6)" size="1" pos="23" show="6" value="06"/>
    <field name="ip.checksum" showname="Header checksum: 0x6907 [validation disabled]" size="2" pos="24" show="26887" value="6907">
      <field name="ip.checksum_good" showname="Good: False" size="2" pos="24" show="0" value="6907"/>
      <field name="ip.checksum_bad" showname="Bad: False" size="2" pos="24" show="0" value="6907"/>
    </field>
    <field name="ip.src" showname="Source: 120.132.34.25 (120.132.34.25)" size="4" pos="26" show="120.132.34.25" value="78842219"/>
    <field name="ip.addr" showname="Source or Destination Address: 120.132.34.25 (120.132.34.25)" hide="yes" size="4" pos="26" show="120.132.34.25" value="78842219"/>
    <field name="ip.src_host" showname="Source Host: 120.132.34.25" hide="yes" size="4" pos="26" show="120.132.34.25" value="78842219"/>
    <field name="ip.host" showname="Source or Destination Host: 120.132.34.25" hide="yes" size="4" pos="26" show="120.132.34.25" value="78842219"/>
    <field name="ip.dst" showname="Destination: 172.28.102.2 (172.28.102.2)" size="4" pos="30" show="172.28.102.2" value="ac1c6602"/>
    <field name="ip.addr" showname="Source or Destination Address: 172.28.102.2 (172.28.102.2)" hide="yes" size="4" pos="30" show="172.28.102.2" value="ac1c6602"/>
    <field name="ip.dst_host" showname="Destination Host: 172.28.102.2" hide="yes" size="4" pos="30" show="172.28.102.2" value="ac1c6602"/>
    <field name="ip.host" showname="Source or Destination Host: 172.28.102.2" hide="yes" size="4" pos="30" show="172.28.102.2" value="ac1c6602"/>
    <field name="" show="Source GeoIP: Unknown" size="4" pos="26" value="78842219"/>
    <field name="" show="Destination GeoIP: Unknown" size="4" pos="30" value="ac1c6602"/>
  </proto>
  <proto name="tcp" showname="Transmission Control Protocol, Src Port: 80 (80), Dst Port: 59949 (59949), Seq: 1, Ack: 1, Len: 0" size="20" pos="34">
    <field name="tcp.srcport" showname="Source Port: 80 (80)" size="2" pos="34" show="80" value="0050"/>
    <field name="tcp.dstport" showname="Destination Port: 59949 (59949)" size="2" pos="36" show="59949" value="ea2d"/>
    <field name="tcp.port" showname="Source or Destination Port: 80" hide="yes" size="2" pos="34" show="80" value="0050"/>
    <field name="tcp.port" showname="Source or Destination Port: 59949" hide="yes" size="2" pos="36" show="59949" value="ea2d"/>
    <field name="tcp.stream" showname="Stream index: 0" size="0" pos="34" show="0"/>
    <field name="tcp.len" showname="TCP Segment Len: 0" size="1" pos="46" show="0" value="50"/>
    <field name="tcp.seq" showname="Sequence number: 1    (relative sequence number)" size="4" pos="38" show="1" value="f25092d3"/>
    <field name="tcp.ack" showname="Acknowledgment number: 1    (relative ack number)" size="4" pos="42" show="1" value="a5791c77"/>
    <field name="tcp.hdr_len" showname="Header Length: 20 bytes" size="1" pos="46" show="20" value="50"/>
    <field name="tcp.flags" showname=".... 0000 0001 0001 = Flags: 0x011 (FIN, ACK)" size="2" pos="46" show="17" value="11" unmaskedvalue="5011">
      <field name="tcp.flags.res" showname="000. .... .... = Reserved: Not set" size="1" pos="46" show="0" value="0" unmaskedvalue="50"/>
      <field name="tcp.flags.ns" showname="...0 .... .... = Nonce: Not set" size="1" pos="46" show="0" value="0" unmaskedvalue="50"/>
      <field name="tcp.flags.cwr" showname=".... 0... .... = Congestion Window Reduced (CWR): Not set" size="1" pos="47" show="0" value="0" unmaskedvalue="11"/>
      <field name="tcp.flags.ecn" showname=".... .0.. .... = ECN-Echo: Not set" size="1" pos="47" show="0" value="0" unmaskedvalue="11"/>
      <field name="tcp.flags.urg" showname=".... ..0. .... = Urgent: Not set" size="1" pos="47" show="0" value="0" unmaskedvalue="11"/>
      <field name="tcp.flags.ack" showname=".... ...1 .... = Acknowledgment: Set" size="1" pos="47" show="1" value="1" unmaskedvalue="11"/>
      <field name="tcp.flags.push" showname=".... .... 0... = Push: Not set" size="1" pos="47" show="0" value="0" unmaskedvalue="11"/>
      <field name="tcp.flags.reset" showname=".... .... .0.. = Reset: Not set" size="1" pos="47" show="0" value="0" unmaskedvalue="11"/>
      <field name="tcp.flags.syn" showname=".... .... ..0. = Syn: Not set" size="1" pos="47" show="0" value="0" unmaskedvalue="11"/>
      <field name="tcp.flags.fin" showname=".... .... ...1 = Fin: Set" size="1" pos="47" show="1" value="1" unmaskedvalue="11">
        <field name="_ws.expert" showname="Expert Info (Chat/Sequence): Connection finish (FIN)" size="0" pos="47">
          <field name="tcp.connection.fin" showname="Connection finish (FIN)" size="0" pos="0" show="" value=""/>
          <field name="_ws.expert.message" showname="Message: Connection finish (FIN)" hide="yes" size="0" pos="0" show="Connection finish (FIN)"/>
          <field name="_ws.expert.severity" showname="Severity level: Chat" size="0" pos="0" show="2097152"/>
          <field name="_ws.expert.group" showname="Group: Sequence" size="0" pos="0" show="33554432"/>
        </field>
      </field>
    </field>
    <field name="tcp.window_size_value" showname="Window size value: 16" size="2" pos="48" show="16" value="0010"/>
    <field name="tcp.window_size" showname="Calculated window size: 16" size="2" pos="48" show="16" value="0010"/>
    <field name="tcp.window_size_scalefactor" showname="Window size scaling factor: -1 (unknown)" size="2" pos="48" show="-1" value="0010"/>
    <field name="tcp.checksum" showname="Checksum: 0xd174 [validation disabled]" size="2" pos="50" show="53620" value="d174">
      <field name="tcp.checksum_good" showname="Good Checksum: False" size="2" pos="50" show="0" value="d174"/>
      <field name="tcp.checksum_bad" showname="Bad Checksum: False" size="2" pos="50" show="0" value="d174"/>
    </field>
    <field name="tcp.urgent_pointer" showname="Urgent pointer: 0" size="2" pos="52" show="0" value="0000"/>
  </proto>
</packet>

<packet>
  <proto name="geninfo" pos="0" showname="General information" size="54">
    <field name="num" pos="0" show="2" showname="Number" value="2" size="54"/>
    <field name="len" pos="0" show="54" showname="Frame Length" value="36" size="54"/>
    <field name="caplen" pos="0" show="54" showname="Captured Length" value="36" size="54"/>
    <field name="timestamp" pos="0" show="Mar 24, 2016 10:12:23.529188000 中国标准时间" showname="Captured Time" value="1458785543.529188000" size="54"/>
  </proto>
  <proto name="frame" showname="Frame 2: 54 bytes on wire (432 bits), 54 bytes captured (432 bits)" size="54" pos="0">
    <field name="frame.encap_type" showname="Encapsulation type: Ethernet (1)" size="0" pos="0" show="1"/>
    <field name="frame.time" showname="Arrival Time: Mar 24, 2016 10:12:23.529188000 \xe4\xb8\xad\xe5\x9b\xbd\xe6\xa0\x87\xe5\x87\x86\xe6\x97\xb6\xe9\x97\xb4" size="0" pos="0" show="Mar 24, 2016 10:12:23.529188000 \xe4\xb8\xad\xe5\x9b\xbd\xe6\xa0\x87\xe5\x87\x86\xe6\x97\xb6\xe9\x97\xb4"/>
    <field name="frame.offset_shift" showname="Time shift for this packet: 0.000000000 seconds" size="0" pos="0" show="0.000000000"/>
    <field name="frame.time_epoch" showname="Epoch Time: 1458785543.529188000 seconds" size="0" pos="0" show="1458785543.529188000"/>
    <field name="frame.time_delta" showname="Time delta from previous captured frame: 0.068287000 seconds" size="0" pos="0" show="0.068287000"/>
    <field name="frame.time_delta_displayed" showname="Time delta from previous displayed frame: 0.068287000 seconds" size="0" pos="0" show="0.068287000"/>
    <field name="frame.time_relative" showname="Time since reference or first frame: 0.068287000 seconds" size="0" pos="0" show="0.068287000"/>
    <field name="frame.number" showname="Frame Number: 2" size="0" pos="0" show="2"/>
    <field name="frame.len" showname="Frame Length: 54 bytes (432 bits)" size="0" pos="0" show="54"/>
    <field name="frame.cap_len" showname="Capture Length: 54 bytes (432 bits)" size="0" pos="0" show="54"/>
    <field name="frame.marked" showname="Frame is marked: False" size="0" pos="0" show="0"/>
    <field name="frame.ignored" showname="Frame is ignored: False" size="0" pos="0" show="0"/>
    <field name="frame.protocols" showname="Protocols in frame: eth:ethertype:ip:tcp" size="0" pos="0" show="eth:ethertype:ip:tcp"/>
    <field name="frame.coloring_rule.name" showname="Coloring Rule Name: HTTP" size="0" pos="0" show="HTTP"/>
    <field name="frame.coloring_rule.string" showname="Coloring Rule String: http || tcp.port == 80 || http2" size="0" pos="0" show="http || tcp.port == 80 || http2"/>
  </proto>
  <proto name="eth" showname="Ethernet II, Src: Apple_d2:fb:83 (54:9f:13:d2:fb:83), Dst: 4a:86:87:51:89:29 (4a:86:87:51:89:29)" size="14" pos="0">
    <field name="eth.dst" showname="Destination: 4a:86:87:51:89:29 (4a:86:87:51:89:29)" size="6" pos="0" show="4a:86:87:51:89:29" value="4a8687518929">
      <field name="eth.dst_resolved" showname="Destination (resolved): 4a:86:87:51:89:29" hide="yes" size="6" pos="0" show="4a:86:87:51:89:29" value="4a8687518929"/>
      <field name="eth.addr" showname="Address: 4a:86:87:51:89:29 (4a:86:87:51:89:29)" size="6" pos="0" show="4a:86:87:51:89:29" value="4a8687518929"/>
      <field name="eth.addr_resolved" showname="Address (resolved): 4a:86:87:51:89:29" hide="yes" size="6" pos="0" show="4a:86:87:51:89:29" value="4a8687518929"/>
      <field name="eth.lg" showname=".... ..1. .... .... .... .... = LG bit: Locally administered address (this is NOT the factory default)" size="3" pos="0" show="1" value="1" unmaskedvalue="4a8687"/>
      <field name="eth.ig" showname=".... ...0 .... .... .... .... = IG bit: Individual address (unicast)" size="3" pos="0" show="0" value="0" unmaskedvalue="4a8687"/>
    </field>
    <field name="eth.src" showname="Source: Apple_d2:fb:83 (54:9f:13:d2:fb:83)" size="6" pos="6" show="54:9f:13:d2:fb:83" value="549f13d2fb83">
      <field name="eth.src_resolved" showname="Source (resolved): Apple_d2:fb:83" hide="yes" size="6" pos="6" show="Apple_d2:fb:83" value="549f13d2fb83"/>
      <field name="eth.addr" showname="Address: Apple_d2:fb:83 (54:9f:13:d2:fb:83)" size="6" pos="6" show="54:9f:13:d2:fb:83" value="549f13d2fb83"/>
      <field name="eth.addr_resolved" showname="Address (resolved): Apple_d2:fb:83" hide="yes" size="6" pos="6" show="Apple_d2:fb:83" value="549f13d2fb83"/>
      <field name="eth.lg" showname=".... ..0. .... .... .... .... = LG bit: Globally unique address (factory default)" size="3" pos="6" show="0" value="0" unmaskedvalue="549f13"/>
      <field name="eth.ig" showname=".... ...0 .... .... .... .... = IG bit: Individual address (unicast)" size="3" pos="6" show="0" value="0" unmaskedvalue="549f13"/>
    </field>
    <field name="eth.type" showname="Type: IP (0x0800)" size="2" pos="12" show="2048" value="0800"/>
  </proto>
  <proto name="ip" showname="Internet Protocol Version 4, Src: 172.28.102.2 (172.28.102.2), Dst: 120.132.34.25 (120.132.34.25)" size="20" pos="14">
    <field name="ip.version" showname="Version: 4" size="1" pos="14" show="4" value="45"/>
    <field name="ip.hdr_len" showname="Header Length: 20 bytes" size="1" pos="14" show="20" value="45"/>
    <field name="ip.dsfield" showname="Differentiated Services Field: 0x00 (DSCP 0x00: Default; ECN: 0x00: Not-ECT (Not ECN-Capable Transport))" size="1" pos="15" show="0" value="00">
      <field name="ip.dsfield.dscp" showname="0000 00.. = Differentiated Services Codepoint: Default (0x00)" size="1" pos="15" show="0" value="0" unmaskedvalue="00"/>
      <field name="ip.dsfield.ecn" showname=".... ..00 = Explicit Congestion Notification: Not-ECT (Not ECN-Capable Transport) (0x00)" size="1" pos="15" show="0" value="0" unmaskedvalue="00"/>
    </field>
    <field name="ip.len" showname="Total Length: 40" size="2" pos="16" show="40" value="0028"/>
    <field name="ip.id" showname="Identification: 0xbeb5 (48821)" size="2" pos="18" show="48821" value="beb5"/>
    <field name="ip.flags" showname="Flags: 0x02 (Don&apos;t Fragment)" size="1" pos="20" show="2" value="40">
      <field name="ip.flags.rb" showname="0... .... = Reserved bit: Not set" size="1" pos="20" show="0" value="40"/>
      <field name="ip.flags.df" showname=".1.. .... = Don&apos;t fragment: Set" size="1" pos="20" show="1" value="40"/>
      <field name="ip.flags.mf" showname="..0. .... = More fragments: Not set" size="1" pos="20" show="0" value="40"/>
    </field>
    <field name="ip.frag_offset" showname="Fragment offset: 0" size="2" pos="20" show="0" value="4000"/>
    <field name="ip.ttl" showname="Time to live: 64" size="1" pos="22" show="64" value="40"/>
    <field name="ip.proto" showname="Protocol: TCP (6)" size="1" pos="23" show="6" value="06"/>
    <field name="ip.checksum" showname="Header checksum: 0xcf5e [validation disabled]" size="2" pos="24" show="53086" value="cf5e">
      <field name="ip.checksum_good" showname="Good: False" size="2" pos="24" show="0" value="cf5e"/>
      <field name="ip.checksum_bad" showname="Bad: False" size="2" pos="24" show="0" value="cf5e"/>
    </field>
    <field name="ip.src" showname="Source: 172.28.102.2 (172.28.102.2)" size="4" pos="26" show="172.28.102.2" value="ac1c6602"/>
    <field name="ip.addr" showname="Source or Destination Address: 172.28.102.2 (172.28.102.2)" hide="yes" size="4" pos="26" show="172.28.102.2" value="ac1c6602"/>
    <field name="ip.src_host" showname="Source Host: 172.28.102.2" hide="yes" size="4" pos="26" show="172.28.102.2" value="ac1c6602"/>
    <field name="ip.host" showname="Source or Destination Host: 172.28.102.2" hide="yes" size="4" pos="26" show="172.28.102.2" value="ac1c6602"/>
    <field name="ip.dst" showname="Destination: 120.132.34.25 (120.132.34.25)" size="4" pos="30" show="120.132.34.25" value="78842219"/>
    <field name="ip.addr" showname="Source or Destination Address: 120.132.34.25 (120.132.34.25)" hide="yes" size="4" pos="30" show="120.132.34.25" value="78842219"/>
    <field name="ip.dst_host" showname="Destination Host: 120.132.34.25" hide="yes" size="4" pos="30" show="120.132.34.25" value="78842219"/>
    <field name="ip.host" showname="Source or Destination Host: 120.132.34.25" hide="yes" size="4" pos="30" show="120.132.34.25" value="78842219"/>
    <field name="" show="Source GeoIP: Unknown" size="4" pos="26" value="ac1c6602"/>
    <field name="" show="Destination GeoIP: Unknown" size="4" pos="30" value="78842219"/>
  </proto>
  <proto name="tcp" showname="Transmission Control Protocol, Src Port: 59949 (59949), Dst Port: 80 (80), Seq: 1, Ack: 2, Len: 0" size="20" pos="34">
    <field name="tcp.srcport" showname="Source Port: 59949 (59949)" size="2" pos="34" show="59949" value="ea2d"/>
    <field name="tcp.dstport" showname="Destination Port: 80 (80)" size="2" pos="36" show="80" value="0050"/>
    <field name="tcp.port" showname="Source or Destination Port: 59949" hide="yes" size="2" pos="34" show="59949" value="ea2d"/>
    <field name="tcp.port" showname="Source or Destination Port: 80" hide="yes" size="2" pos="36" show="80" value="0050"/>
    <field name="tcp.stream" showname="Stream index: 0" size="0" pos="34" show="0"/>
    <field name="tcp.len" showname="TCP Segment Len: 0" size="1" pos="46" show="0" value="50"/>
    <field name="tcp.seq" showname="Sequence number: 1    (relative sequence number)" size="4" pos="38" show="1" value="a5791c77"/>
    <field name="tcp.ack" showname="Acknowledgment number: 2    (relative ack number)" size="4" pos="42" show="2" value="f25092d4"/>
    <field name="tcp.hdr_len" showname="Header Length: 20 bytes" size="1" pos="46" show="20" value="50"/>
    <field name="tcp.flags" showname=".... 0000 0001 0000 = Flags: 0x010 (ACK)" size="2" pos="46" show="16" value="10" unmaskedvalue="5010">
      <field name="tcp.flags.res" showname="000. .... .... = Reserved: Not set" size="1" pos="46" show="0" value="0" unmaskedvalue="50"/>
      <field name="tcp.flags.ns" showname="...0 .... .... = Nonce: Not set" size="1" pos="46" show="0" value="0" unmaskedvalue="50"/>
      <field name="tcp.flags.cwr" showname=".... 0... .... = Congestion Window Reduced (CWR): Not set" size="1" pos="47" show="0" value="0" unmaskedvalue="10"/>
      <field name="tcp.flags.ecn" showname=".... .0.. .... = ECN-Echo: Not set" size="1" pos="47" show="0" value="0" unmaskedvalue="10"/>
      <field name="tcp.flags.urg" showname=".... ..0. .... = Urgent: Not set" size="1" pos="47" show="0" value="0" unmaskedvalue="10"/>
      <field name="tcp.flags.ack" showname=".... ...1 .... = Acknowledgment: Set" size="1" pos="47" show="1" value="1" unmaskedvalue="10"/>
      <field name="tcp.flags.push" showname=".... .... 0... = Push: Not set" size="1" pos="47" show="0" value="0" unmaskedvalue="10"/>
      <field name="tcp.flags.reset" showname=".... .... .0.. = Reset: Not set" size="1" pos="47" show="0" value="0" unmaskedvalue="10"/>
      <field name="tcp.flags.syn" showname=".... .... ..0. = Syn: Not set" size="1" pos="47" show="0" value="0" unmaskedvalue="10"/>
      <field name="tcp.flags.fin" showname=".... .... ...0 = Fin: Not set" size="1" pos="47" show="0" value="0" unmaskedvalue="10"/>
    </field>
    <field name="tcp.window_size_value" showname="Window size value: 8192" size="2" pos="48" show="8192" value="2000"/>
    <field name="tcp.window_size" showname="Calculated window size: 8192" size="2" pos="48" show="8192" value="2000"/>
    <field name="tcp.window_size_scalefactor" showname="Window size scaling factor: -1 (unknown)" size="2" pos="48" show="-1" value="2000"/>
    <field name="tcp.checksum" showname="Checksum: 0xb184 [validation disabled]" size="2" pos="50" show="45444" value="b184">
      <field name="tcp.checksum_good" showname="Good Checksum: False" size="2" pos="50" show="0" value="b184"/>
      <field name="tcp.checksum_bad" showname="Bad Checksum: False" size="2" pos="50" show="0" value="b184"/>
    </field>
    <field name="tcp.urgent_pointer" showname="Urgent pointer: 0" size="2" pos="52" show="0" value="0000"/>
    <field name="tcp.analysis" showname="SEQ/ACK analysis" size="0" pos="34" show="" value="">
      <field name="tcp.analysis.acks_frame" showname="This is an ACK to the segment in frame: 1" size="0" pos="34" show="1"/>
      <field name="tcp.analysis.ack_rtt" showname="The RTT to ACK the segment was: 0.068287000 seconds" size="0" pos="34" show="0.068287000"/>
    </field>
  </proto>
</packet>

<packet>
  <proto name="geninfo" pos="0" showname="General information" size="54">
    <field name="num" pos="0" show="3" showname="Number" value="3" size="54"/>
    <field name="len" pos="0" show="54" showname="Frame Length" value="36" size="54"/>
    <field name="caplen" pos="0" show="54" showname="Captured Length" value="36" size="54"/>
    <field name="timestamp" pos="0" show="Mar 24, 2016 10:12:24.089425000 中国标准时间" showname="Captured Time" value="1458785544.089425000" size="54"/>
  </proto>
  <proto name="frame" showname="Frame 3: 54 bytes on wire (432 bits), 54 bytes captured (432 bits)" size="54" pos="0">
    <field name="frame.encap_type" showname="Encapsulation type: Ethernet (1)" size="0" pos="0" show="1"/>
    <field name="frame.time" showname="Arrival Time: Mar 24, 2016 10:12:24.089425000 \xe4\xb8\xad\xe5\x9b\xbd\xe6\xa0\x87\xe5\x87\x86\xe6\x97\xb6\xe9\x97\xb4" size="0" pos="0" show="Mar 24, 2016 10:12:24.089425000 \xe4\xb8\xad\xe5\x9b\xbd\xe6\xa0\x87\xe5\x87\x86\xe6\x97\xb6\xe9\x97\xb4"/>
    <field name="frame.offset_shift" showname="Time shift for this packet: 0.000000000 seconds" size="0" pos="0" show="0.000000000"/>
    <field name="frame.time_epoch" showname="Epoch Time: 1458785544.089425000 seconds" size="0" pos="0" show="1458785544.089425000"/>
    <field name="frame.time_delta" showname="Time delta from previous captured frame: 0.560237000 seconds" size="0" pos="0" show="0.560237000"/>
    <field name="frame.time_delta_displayed" showname="Time delta from previous displayed frame: 0.560237000 seconds" size="0" pos="0" show="0.560237000"/>
    <field name="frame.time_relative" showname="Time since reference or first frame: 0.628524000 seconds" size="0" pos="0" show="0.628524000"/>
    <field name="frame.number" showname="Frame Number: 3" size="0" pos="0" show="3"/>
    <field name="frame.len" showname="Frame Length: 54 bytes (432 bits)" size="0" pos="0" show="54"/>
    <field name="frame.cap_len" showname="Capture Length: 54 bytes (432 bits)" size="0" pos="0" show="54"/>
    <field name="frame.marked" showname="Frame is marked: False" size="0" pos="0" show="0"/>
    <field name="frame.ignored" showname="Frame is ignored: False" size="0" pos="0" show="0"/>
    <field name="frame.protocols" showname="Protocols in frame: eth:ethertype:ip:tcp" size="0" pos="0" show="eth:ethertype:ip:tcp"/>
    <field name="frame.coloring_rule.name" showname="Coloring Rule Name: HTTP" size="0" pos="0" show="HTTP"/>
    <field name="frame.coloring_rule.string" showname="Coloring Rule String: http || tcp.port == 80 || http2" size="0" pos="0" show="http || tcp.port == 80 || http2"/>
  </proto>
  <proto name="eth" showname="Ethernet II, Src: Apple_d2:fb:83 (54:9f:13:d2:fb:83), Dst: 4a:86:87:51:89:29 (4a:86:87:51:89:29)" size="14" pos="0">
    <field name="eth.dst" showname="Destination: 4a:86:87:51:89:29 (4a:86:87:51:89:29)" size="6" pos="0" show="4a:86:87:51:89:29" value="4a8687518929">
      <field name="eth.dst_resolved" showname="Destination (resolved): 4a:86:87:51:89:29" hide="yes" size="6" pos="0" show="4a:86:87:51:89:29" value="4a8687518929"/>
      <field name="eth.addr" showname="Address: 4a:86:87:51:89:29 (4a:86:87:51:89:29)" size="6" pos="0" show="4a:86:87:51:89:29" value="4a8687518929"/>
      <field name="eth.addr_resolved" showname="Address (resolved): 4a:86:87:51:89:29" hide="yes" size="6" pos="0" show="4a:86:87:51:89:29" value="4a8687518929"/>
      <field name="eth.lg" showname=".... ..1. .... .... .... .... = LG bit: Locally administered address (this is NOT the factory default)" size="3" pos="0" show="1" value="1" unmaskedvalue="4a8687"/>
      <field name="eth.ig" showname=".... ...0 .... .... .... .... = IG bit: Individual address (unicast)" size="3" pos="0" show="0" value="0" unmaskedvalue="4a8687"/>
    </field>
    <field name="eth.src" showname="Source: Apple_d2:fb:83 (54:9f:13:d2:fb:83)" size="6" pos="6" show="54:9f:13:d2:fb:83" value="549f13d2fb83">
      <field name="eth.src_resolved" showname="Source (resolved): Apple_d2:fb:83" hide="yes" size="6" pos="6" show="Apple_d2:fb:83" value="549f13d2fb83"/>
      <field name="eth.addr" showname="Address: Apple_d2:fb:83 (54:9f:13:d2:fb:83)" size="6" pos="6" show="54:9f:13:d2:fb:83" value="549f13d2fb83"/>
      <field name="eth.addr_resolved" showname="Address (resolved): Apple_d2:fb:83" hide="yes" size="6" pos="6" show="Apple_d2:fb:83" value="549f13d2fb83"/>
      <field name="eth.lg" showname=".... ..0. .... .... .... .... = LG bit: Globally unique address (factory default)" size="3" pos="6" show="0" value="0" unmaskedvalue="549f13"/>
      <field name="eth.ig" showname=".... ...0 .... .... .... .... = IG bit: Individual address (unicast)" size="3" pos="6" show="0" value="0" unmaskedvalue="549f13"/>
    </field>
    <field name="eth.type" showname="Type: IP (0x0800)" size="2" pos="12" show="2048" value="0800"/>
  </proto>
  <proto name="ip" showname="Internet Protocol Version 4, Src: 172.28.102.2 (172.28.102.2), Dst: 120.132.34.25 (120.132.34.25)" size="20" pos="14">
    <field name="ip.version" showname="Version: 4" size="1" pos="14" show="4" value="45"/>
    <field name="ip.hdr_len" showname="Header Length: 20 bytes" size="1" pos="14" show="20" value="45"/>
    <field name="ip.dsfield" showname="Differentiated Services Field: 0x00 (DSCP 0x00: Default; ECN: 0x00: Not-ECT (Not ECN-Capable Transport))" size="1" pos="15" show="0" value="00">
      <field name="ip.dsfield.dscp" showname="0000 00.. = Differentiated Services Codepoint: Default (0x00)" size="1" pos="15" show="0" value="0" unmaskedvalue="00"/>
      <field name="ip.dsfield.ecn" showname=".... ..00 = Explicit Congestion Notification: Not-ECT (Not ECN-Capable Transport) (0x00)" size="1" pos="15" show="0" value="0" unmaskedvalue="00"/>
    </field>
    <field name="ip.len" showname="Total Length: 40" size="2" pos="16" show="40" value="0028"/>
    <field name="ip.id" showname="Identification: 0xf323 (62243)" size="2" pos="18" show="62243" value="f323"/>
    <field name="ip.flags" showname="Flags: 0x02 (Don&apos;t Fragment)" size="1" pos="20" show="2" value="40">
      <field name="ip.flags.rb" showname="0... .... = Reserved bit: Not set" size="1" pos="20" show="0" value="40"/>
      <field name="ip.flags.df" showname=".1.. .... = Don&apos;t fragment: Set" size="1" pos="20" show="1" value="40"/>
      <field name="ip.flags.mf" showname="..0. .... = More fragments: Not set" size="1" pos="20" show="0" value="40"/>
    </field>
    <field name="ip.frag_offset" showname="Fragment offset: 0" size="2" pos="20" show="0" value="4000"/>
    <field name="ip.ttl" showname="Time to live: 64" size="1" pos="22" show="64" value="40"/>
    <field name="ip.proto" showname="Protocol: TCP (6)" size="1" pos="23" show="6" value="06"/>
    <field name="ip.checksum" showname="Header checksum: 0x9af0 [validation disabled]" size="2" pos="24" show="39664" value="9af0">
      <field name="ip.checksum_good" showname="Good: False" size="2" pos="24" show="0" value="9af0"/>
      <field name="ip.checksum_bad" showname="Bad: False" size="2" pos="24" show="0" value="9af0"/>
    </field>
    <field name="ip.src" showname="Source: 172.28.102.2 (172.28.102.2)" size="4" pos="26" show="172.28.102.2" value="ac1c6602"/>
    <field name="ip.addr" showname="Source or Destination Address: 172.28.102.2 (172.28.102.2)" hide="yes" size="4" pos="26" show="172.28.102.2" value="ac1c6602"/>
    <field name="ip.src_host" showname="Source Host: 172.28.102.2" hide="yes" size="4" pos="26" show="172.28.102.2" value="ac1c6602"/>
    <field name="ip.host" showname="Source or Destination Host: 172.28.102.2" hide="yes" size="4" pos="26" show="172.28.102.2" value="ac1c6602"/>
    <field name="ip.dst" showname="Destination: 120.132.34.25 (120.132.34.25)" size="4" pos="30" show="120.132.34.25" value="78842219"/>
    <field name="ip.addr" showname="Source or Destination Address: 120.132.34.25 (120.132.34.25)" hide="yes" size="4" pos="30" show="120.132.34.25" value="78842219"/>
    <field name="ip.dst_host" showname="Destination Host: 120.132.34.25" hide="yes" size="4" pos="30" show="120.132.34.25" value="78842219"/>
    <field name="ip.host" showname="Source or Destination Host: 120.132.34.25" hide="yes" size="4" pos="30" show="120.132.34.25" value="78842219"/>
    <field name="" show="Source GeoIP: Unknown" size="4" pos="26" value="ac1c6602"/>
    <field name="" show="Destination GeoIP: Unknown" size="4" pos="30" value="78842219"/>
  </proto>
  <proto name="tcp" showname="Transmission Control Protocol, Src Port: 59949 (59949), Dst Port: 80 (80), Seq: 1, Ack: 2, Len: 0" size="20" pos="34">
    <field name="tcp.srcport" showname="Source Port: 59949 (59949)" size="2" pos="34" show="59949" value="ea2d"/>
    <field name="tcp.dstport" showname="Destination Port: 80 (80)" size="2" pos="36" show="80" value="0050"/>
    <field name="tcp.port" showname="Source or Destination Port: 59949" hide="yes" size="2" pos="34" show="59949" value="ea2d"/>
    <field name="tcp.port" showname="Source or Destination Port: 80" hide="yes" size="2" pos="36" show="80" value="0050"/>
    <field name="tcp.stream" showname="Stream index: 0" size="0" pos="34" show="0"/>
    <field name="tcp.len" showname="TCP Segment Len: 0" size="1" pos="46" show="0" value="50"/>
    <field name="tcp.seq" showname="Sequence number: 1    (relative sequence number)" size="4" pos="38" show="1" value="a5791c77"/>
    <field name="tcp.ack" showname="Acknowledgment number: 2    (relative ack number)" size="4" pos="42" show="2" value="f25092d4"/>
    <field name="tcp.hdr_len" showname="Header Length: 20 bytes" size="1" pos="46" show="20" value="50"/>
    <field name="tcp.flags" showname=".... 0000 0001 0001 = Flags: 0x011 (FIN, ACK)" size="2" pos="46" show="17" value="11" unmaskedvalue="5011">
      <field name="tcp.flags.res" showname="000. .... .... = Reserved: Not set" size="1" pos="46" show="0" value="0" unmaskedvalue="50"/>
      <field name="tcp.flags.ns" showname="...0 .... .... = Nonce: Not set" size="1" pos="46" show="0" value="0" unmaskedvalue="50"/>
      <field name="tcp.flags.cwr" showname=".... 0... .... = Congestion Window Reduced (CWR): Not set" size="1" pos="47" show="0" value="0" unmaskedvalue="11"/>
      <field name="tcp.flags.ecn" showname=".... .0.. .... = ECN-Echo: Not set" size="1" pos="47" show="0" value="0" unmaskedvalue="11"/>
      <field name="tcp.flags.urg" showname=".... ..0. .... = Urgent: Not set" size="1" pos="47" show="0" value="0" unmaskedvalue="11"/>
      <field name="tcp.flags.ack" showname=".... ...1 .... = Acknowledgment: Set" size="1" pos="47" show="1" value="1" unmaskedvalue="11"/>
      <field name="tcp.flags.push" showname=".... .... 0... = Push: Not set" size="1" pos="47" show="0" value="0" unmaskedvalue="11"/>
      <field name="tcp.flags.reset" showname=".... .... .0.. = Reset: Not set" size="1" pos="47" show="0" value="0" unmaskedvalue="11"/>
      <field name="tcp.flags.syn" showname=".... .... ..0. = Syn: Not set" size="1" pos="47" show="0" value="0" unmaskedvalue="11"/>
      <field name="tcp.flags.fin" showname=".... .... ...1 = Fin: Set" size="1" pos="47" show="1" value="1" unmaskedvalue="11">
        <field name="_ws.expert" showname="Expert Info (Chat/Sequence): Connection finish (FIN)" size="0" pos="47">
          <field name="tcp.connection.fin" showname="Connection finish (FIN)" size="0" pos="0" show="" value=""/>
          <field name="_ws.expert.message" showname="Message: Connection finish (FIN)" hide="yes" size="0" pos="0" show="Connection finish (FIN)"/>
          <field name="_ws.expert.severity" showname="Severity level: Chat" size="0" pos="0" show="2097152"/>
          <field name="_ws.expert.group" showname="Group: Sequence" size="0" pos="0" show="33554432"/>
        </field>
      </field>
    </field>
    <field name="tcp.window_size_value" showname="Window size value: 8192" size="2" pos="48" show="8192" value="2000"/>
    <field name="tcp.window_size" showname="Calculated window size: 8192" size="2" pos="48" show="8192" value="2000"/>
    <field name="tcp.window_size_scalefactor" showname="Window size scaling factor: -1 (unknown)" size="2" pos="48" show="-1" value="2000"/>
    <field name="tcp.checksum" showname="Checksum: 0xb183 [validation disabled]" size="2" pos="50" show="45443" value="b183">
      <field name="tcp.checksum_good" showname="Good Checksum: False" size="2" pos="50" show="0" value="b183"/>
      <field name="tcp.checksum_bad" showname="Bad Checksum: False" size="2" pos="50" show="0" value="b183"/>
    </field>
    <field name="tcp.urgent_pointer" showname="Urgent pointer: 0" size="2" pos="52" show="0" value="0000"/>
  </proto>
</packet>

<packet>
  <proto name="geninfo" pos="0" showname="General information" size="54">
    <field name="num" pos="0" show="4" showname="Number" value="4" size="54"/>
    <field name="len" pos="0" show="54" showname="Frame Length" value="36" size="54"/>
    <field name="caplen" pos="0" show="54" showname="Captured Length" value="36" size="54"/>
    <field name="timestamp" pos="0" show="Mar 24, 2016 10:12:24.089427000 中国标准时间" showname="Captured Time" value="1458785544.089427000" size="54"/>
  </proto>
  <proto name="frame" showname="Frame 4: 54 bytes on wire (432 bits), 54 bytes captured (432 bits)" size="54" pos="0">
    <field name="frame.encap_type" showname="Encapsulation type: Ethernet (1)" size="0" pos="0" show="1"/>
    <field name="frame.time" showname="Arrival Time: Mar 24, 2016 10:12:24.089427000 \xe4\xb8\xad\xe5\x9b\xbd\xe6\xa0\x87\xe5\x87\x86\xe6\x97\xb6\xe9\x97\xb4" size="0" pos="0" show="Mar 24, 2016 10:12:24.089427000 \xe4\xb8\xad\xe5\x9b\xbd\xe6\xa0\x87\xe5\x87\x86\xe6\x97\xb6\xe9\x97\xb4"/>
    <field name="frame.offset_shift" showname="Time shift for this packet: 0.000000000 seconds" size="0" pos="0" show="0.000000000"/>
    <field name="frame.time_epoch" showname="Epoch Time: 1458785544.089427000 seconds" size="0" pos="0" show="1458785544.089427000"/>
    <field name="frame.time_delta" showname="Time delta from previous captured frame: 0.000002000 seconds" size="0" pos="0" show="0.000002000"/>
    <field name="frame.time_delta_displayed" showname="Time delta from previous displayed frame: 0.000002000 seconds" size="0" pos="0" show="0.000002000"/>
    <field name="frame.time_relative" showname="Time since reference or first frame: 0.628526000 seconds" size="0" pos="0" show="0.628526000"/>
    <field name="frame.number" showname="Frame Number: 4" size="0" pos="0" show="4"/>
